{
  "$schema": "./overrides.schema.json",
  "mapKey": "china",
  "source": {
    "id": "v206-mapdat",
    "expectResourceSha256": "6a589d151efc800cb7ca9e41c988c36405b93a8aa52e6126c23858aa3e535d6e"
  },
  "lattice": { "tile": 48, "origin": [32, 39], "transform": "identity" },
  "compact": false,
  "nodeCell": {
    "75": [17, 37],
    "76": [17, 36],
    "90": [29, 33],
    "121": [35, 23],
    "122": [36, 22],
    "135": [42, 9]
  },
  "edgeRoute": {
    "26-27": [[18, 14]],
    "79-80": [[20, 34]],
    "121-122": [[36, 23]]
  },
  "lot": {
    "C1": { "rect": [16, 12, 2, 2] },
    "C2": { "rect": [34, 21, 2, 2] },
    "F7": { "rect": [21, 32, 2, 2] }
  },
  "landmark": {},
  "terrain": { "margin": 4 },
  "expect": { "nodes": 144, "lands": 73, "facilities": 8, "companies": 4, "landscapes": 26 },
  "notes": [
    "坐标为格点坐标：(世界坐标 − origin) / tile 四舍五入、再做 transform 之后，平移到原点之前（与 taiwan.overrides.json 相同）。",
    "基线 source.id = v206-mapdat（MapDat.MKF#1）：v2.06 exe 先读 MapDat.MKF[gm]、失败才回退 map.mkf（tools/extract/src/map/sources.ts 的 RAW_SOURCES 顺序），且与 v3.11 map.mkf#3 一致。map diff 唯一的规则相关差异是 companies#4 名称：MapDat 与 v3.11 为「王井府百貨」，v2.06 map.mkf 为「玉井府百貨」；照 MapDat 原样保留。股票表 0x47ce92 + 432 下标 2 为「王府井百貨」，企业↔股票核对登记为已知不一致（exe/mapData.ts KNOWN_NAME_MISMATCHES），不改原版数据。",
    "expectResourceSha256 锁定 MapDat.MKF#1 的资源字节；输入变化时本文件整体作废（exit 5），需重新审阅。",
    "lattice：T=32 覆盖率只有 5.6%；自动检测得到 T=48、原点 (32,39)（0 个节点同格），此处固定下来。transform 暂用 identity，尚未与原版截图核对。",
    "terrain.margin 4：与台湾相同，四周多留两格让外海与海岸显示出来。",
    "edgeRoute 79-80 + lot.F7：设施 F7 貴陽（前沿 80、81）只能放在 80/81 正上方的 (21..22, 32..33)；79→80 的 L 形连接格默认走 (21,33) 会占住它（E_LOT_NO_CELL），改走 (20,34)。F7 的 rect 与自动结果相同，写明是为了把这对决定钉住。",
    "nodeCell 75、76：昆明街（75–78，住宅地 L35–L38 在东南侧）原量化成「北→东北→东」的阶梯，76 与 77 都只剩同一个东南侧空格，L37 只能放到西北侧；76 (17,35) 还与不相连的 73 (16,35) 在网格上相邻（W_TILES_TOUCH 73/76）。75、76 各下移一格后四块地都在东南侧，73/76 不再相邻（两条要一起改：只改 76 会与 75 同格，只改 75 则 L37 仍偏侧）。",
    "nodeCell 90：桂林街（86–90，住宅地在西北侧）的 89 西北两侧被 88 与 L46 占住，L45 只能放到东南侧；90 上移一格后 L45 回到 89 北侧，90 与不相连的 92 也不再相邻（W_TILES_TOUCH 90/92）。",
    "nodeCell 121、122 + edgeRoute 121-122 + lot.C2：121 (36,23) 原与不相连的 119 (36,24) 相邻（W_TILES_TOUCH 119/121）。121 左移、122 左移后，C2 中國人壽的两个前沿格 121、122 成一对斜向格；它们之间的连接格改走东南侧 (36,23)，腾出西北侧（世界坐标所在一侧）放 2×2（否则企业只能挤成 1×1）。",
    "nodeCell 135：北京街（130–134，住宅地在西北侧）的 L73（前沿 134）原来只能放到东南侧；135 左移一格后拐角翻转把 134 移到 (41,9)，L73 回到西北侧。",
    "edgeRoute 26-27 + lot.C1：C1 中國石油的前沿格 26、27 是一对斜向格，默认连接格 (17,13) 在西北侧，企业只能挤成 1×1 放到东南侧；连接格改走 (18,14)，企业 2×2 放回西北侧（世界坐标 (807,623) 所在一侧）。",
    "剩下的告警都是原版结构，不处理：W_LINK_ONEWAY 28（監獄）→136 的静态封路；W_DEADEND 136–144 支路尽头的监狱关押格 144；W_COMPANY_REMOTE_FRONT C4 王井府百貨的前沿格 10 与 115 相距过远（原版同一企业的两个百貨格分处南北）。"
  ]
}
